[
  {
    "chunk_id": "ONGC-SM-SOP-04-C00",
    "doc_id": "ONGC-SM-SOP-04",
    "doc_type": "SOP",
    "section_path": "ONGC-SM-SOP-04: Deepwater Narrow-Window Drilling Protocol (illustrative)",
    "page": 1,
    "text": "# ONGC-SM-SOP-04: Deepwater Narrow-Window Drilling Protocol (illustrative)",
    "tokens": 7,
    "well_id": "MN-SM-DW-01",
    "tags": [
      "narrow-window",
      "pore-pressure",
      "transition-zone",
      "rop-cap"
    ],
    "authoring": "synthetic"
  },
  {
    "chunk_id": "ONGC-SM-SOP-04-C01",
    "doc_id": "ONGC-SM-SOP-04",
    "doc_type": "SOP",
    "section_path": "1. Purpose & Scope",
    "page": 1,
    "text": "## 1. Purpose & Scope\nThis Standard Operating Procedure establishes operational protocols for safely traversing narrow drilling margins in deepwater Mahanadi offshore prospects (including MN-SM-DW-01, water depth 1,620 m). It specifies mandatory triggers for pre-emptive mud weight increases, drilling break management, and flow checks.",
    "tokens": 44,
    "well_id": "MN-SM-DW-01",
    "tags": [
      "narrow-window",
      "pore-pressure",
      "transition-zone",
      "rop-cap"
    ],
    "authoring": "synthetic"
  },
  {
    "chunk_id": "ONGC-SM-SOP-04-C02",
    "doc_id": "ONGC-SM-SOP-04",
    "doc_type": "SOP",
    "section_path": "2. Responsibilities",
    "page": 1,
    "text": "## 2. Responsibilities\n- **Company Man / OIM**: Ultimate rig authority; enforces hold points and approves MOC submissions.\n- **Drilling Superintendent (RTOC)**: Real-time surveillance lead; monitors LWD sonic/resistivity trends and authorizes weight-up.\n- **Mud Engineer**: Formulates SOBM weighting schedule, supervises barite addition, and verifies mud density parity (in/out).\n- **Driller**: Immediately executes ROP restriction upon encountering lithological breaks.",
    "tokens": 58,
    "well_id": "MN-SM-DW-01",
    "tags": [
      "narrow-window",
      "pore-pressure",
      "transition-zone",
      "rop-cap"
    ],
    "authoring": "synthetic"
  },
  {
    "chunk_id": "ONGC-SM-SOP-04-C03",
    "doc_id": "ONGC-SM-SOP-04",
    "doc_type": "SOP",
    "section_path": "3. Definitions & Narrow Margin Context",
    "page": 1,
    "text": "## 3. Definitions & Narrow Margin Context\n- **Narrow Margin Drilling**: Intervals where the pore pressure (PP) and fracture gradient / casing shoe FIT margin is $\\le 0.65\\text{ ppg}$.\n- **13-3/8 in Casing Shoe**: Set at 3,850 m MD with Formation Integrity Test (FIT) established at 12.10 ppg (1.45 SG).\n- **Safe Drilling Envelope**: Maximum permissible Equivalent Circulating Density (ECD) must remain below 12.00 ppg to protect the 13-3/8 in shoe.",
    "tokens": 71,
    "well_id": "MN-SM-DW-01",
    "tags": [
      "narrow-window",
      "pore-pressure",
      "transition-zone",
      "rop-cap"
    ],
    "authoring": "synthetic"
  },
  {
    "chunk_id": "ONGC-SM-SOP-04-C04",
    "doc_id": "ONGC-SM-SOP-04",
    "doc_type": "SOP",
    "section_path": "4. Operational Hold Points & Mandatory Triggers",
    "page": 2,
    "text": "## 4. Operational Hold Points & Mandatory Triggers\n1. **Transition Zone Identification (4,150 m to 4,195 m MD)**:\n   - When compressional slowness ($DT$) increases above the Normal Compaction Trend (NCT) by $> 8\\ \\mu\\text{s/ft}$, or resistivity ($R_{\\text{deep}}$) departs below NCT, enter **High Alert Status**.\n   - Background gas trending upward from baseline requires continuous chromatograph inspection ($C_1$ through $C_5$).\n2. **Pre-emptive Weight-Up Trigger (4,172 m MD)**:\n   - In accordance with offset incident `INC-MN-DW-02-KICK-4195`, mud weight must NOT be kept at 11.20 ppg (1.34 SG) entering the pay sand.\n   - Mud weight must be raised pre-emptively from 11.20 ppg (1.34 SG) to **11.65 ppg (1.40 SG)** prior to crossing 4,195 m MD.\n   - This provides a minimum +0.17 ppg (+100 psi) overbalance against the projected sand pore pressure of 11.48 ppg (1.38 SG).",
    "tokens": 131,
    "well_id": "MN-SM-DW-01",
    "tags": [
      "narrow-window",
      "pore-pressure",
      "transition-zone",
      "rop-cap"
    ],
    "authoring": "synthetic"
  },
  {
    "chunk_id": "ONGC-SM-SOP-04-C05",
    "doc_id": "ONGC-SM-SOP-04",
    "doc_type": "SOP",
    "section_path": "5. Drilling Break Protocol & ROP Cap",
    "page": 2,
    "text": "## 5. Drilling Break Protocol & ROP Cap\n- **Sand Entry at 4,195 m MD**:\n  - Main reservoir pay (Miocene slope-channel turbidite sandstone) exhibits instantaneous ROP acceleration up to 34 m/hr.\n  - **Mandatory Action**: The driller must immediately throttle WOB/RPM to cap ROP at **$\\le 12\\text{ m/hr}$**.\n  - **Flow Check**: Perform a mandatory 15-minute static flow check at 4,196 m MD (pumps off, trip tank monitoring).\n  - Uncapped ROP in narrow windows generates heavy cuttings loading and annular friction surges that cause catastrophic losses (reference: `INC-MN-DW-03-LOSS-4222`).",
    "tokens": 86,
    "well_id": "MN-SM-DW-01",
    "tags": [
      "narrow-window",
      "pore-pressure",
      "transition-zone",
      "rop-cap"
    ],
    "authoring": "synthetic"
  },
  {
    "chunk_id": "ONGC-SM-SOP-04-C06",
    "doc_id": "ONGC-SM-SOP-04",
    "doc_type": "SOP",
    "section_path": "6. Records & Regulatory References",
    "page": 2,
    "text": "## 6. Records & Regulatory References\n- MOC records must be logged into RTOC digital ledger.\n- References: ONGC Deepwater Drilling Manual \u00a714; API RP 13B-1; IWCF Deepwater Well Control Compendium \u00a74.",
    "tokens": 32,
    "well_id": "MN-SM-DW-01",
    "tags": [
      "narrow-window",
      "pore-pressure",
      "transition-zone",
      "rop-cap"
    ],
    "authoring": "synthetic"
  },
  {
    "chunk_id": "ONGC-HC-SOP-05-C00",
    "doc_id": "ONGC-HC-SOP-05",
    "doc_type": "SOP",
    "section_path": "ONGC-HC-SOP-05: Hole Cleaning & ECD Management in Deepwater (illustrative)",
    "page": 1,
    "text": "# ONGC-HC-SOP-05: Hole Cleaning & ECD Management in Deepwater (illustrative)",
    "tokens": 10,
    "well_id": "MN-SM-DW-01",
    "tags": [
      "hole-cleaning",
      "ecd",
      "hydraulics",
      "losses"
    ],
    "authoring": "synthetic"
  },
  {
    "chunk_id": "ONGC-HC-SOP-05-C01",
    "doc_id": "ONGC-HC-SOP-05",
    "doc_type": "SOP",
    "section_path": "1. Scope",
    "page": 1,
    "text": "## 1. Scope\nApplies to large-diameter deepwater hole sections (12-1/4 in and 17-1/2 in) where annular fluid velocities must balance hole cleaning against excessive Equivalent Circulating Density (ECD).",
    "tokens": 28,
    "well_id": "MN-SM-DW-01",
    "tags": [
      "hole-cleaning",
      "ecd",
      "hydraulics",
      "losses"
    ],
    "authoring": "synthetic"
  },
  {
    "chunk_id": "ONGC-HC-SOP-05-C02",
    "doc_id": "ONGC-HC-SOP-05",
    "doc_type": "SOP",
    "section_path": "2. Hydraulic Limits for 12-1/4 in Section at 4,200 m MD",
    "page": 1,
    "text": "## 2. Hydraulic Limits for 12-1/4 in Section at 4,200 m MD\n- Nominal flow rate: 850 gpm.\n- Maximum allowable ECD: 12.00 ppg (shoe FIT: 12.10 ppg).\n- Dynamic annular pressure loss must not exceed 0.35 ppg equivalent over static mud weight.",
    "tokens": 43,
    "well_id": "MN-SM-DW-01",
    "tags": [
      "hole-cleaning",
      "ecd",
      "hydraulics",
      "losses"
    ],
    "authoring": "synthetic"
  },
  {
    "chunk_id": "ONGC-HC-SOP-05-C03",
    "doc_id": "ONGC-HC-SOP-05",
    "doc_type": "SOP",
    "section_path": "3. High-ROP Cuttings Management",
    "page": 1,
    "text": "## 3. High-ROP Cuttings Management\n- When ROP exceeds 25 m/hr, cuttings concentration in the annulus escalates rapidly, elevating ECD by up to 0.40 ppg.\n- High-viscosity low-shear sweeps (20 bbl tandem pills) must be pumped every 100 m drilled.\n- If ECD approaches within 0.10 ppg of fracture limit (12.00 ppg), immediately reduce flow rate or cap ROP.",
    "tokens": 59,
    "well_id": "MN-SM-DW-01",
    "tags": [
      "hole-cleaning",
      "ecd",
      "hydraulics",
      "losses"
    ],
    "authoring": "synthetic"
  },
  {
    "chunk_id": "ONGC-WCR-SOP-09-C00",
    "doc_id": "ONGC-WCR-SOP-09",
    "doc_type": "SOP",
    "section_path": "ONGC-WCR-SOP-09: End-of-Well Completion Report Compilation Standard (illustrative)",
    "page": 1,
    "text": "# ONGC-WCR-SOP-09: End-of-Well Completion Report Compilation Standard (illustrative)",
    "tokens": 8,
    "well_id": "MN-SM-DW-01",
    "tags": [
      "wcr",
      "reporting",
      "post-well-analysis",
      "compliance"
    ],
    "authoring": "synthetic"
  },
  {
    "chunk_id": "ONGC-WCR-SOP-09-C01",
    "doc_id": "ONGC-WCR-SOP-09",
    "doc_type": "SOP",
    "section_path": "1. Overview",
    "page": 1,
    "text": "## 1. Overview\nPrescribes the structure, minimum engineering content, and analytical deliverables required for the Well Completion Report (WCR) upon reaching section Total Depth (TD) or final well TD.",
    "tokens": 29,
    "well_id": "MN-SM-DW-01",
    "tags": [
      "wcr",
      "reporting",
      "post-well-analysis",
      "compliance"
    ],
    "authoring": "synthetic"
  },
  {
    "chunk_id": "ONGC-WCR-SOP-09-C02",
    "doc_id": "ONGC-WCR-SOP-09",
    "doc_type": "SOP",
    "section_path": "2. Standard Document Structure",
    "page": 1,
    "text": "## 2. Standard Document Structure\n- **Section 1**: Well Summary Data (coordinates, water depth, spud date, rig specs, casing points).\n- **Section 2**: Stratigraphic & Geological Summary (formation tops, lithology descriptions, reservoir evaluation).\n- **Section 3**: Drilling Operations Diary (interval-by-interval progress, bit performance, BHA records).\n- **Section 4**: Pore Pressure & Geomechanics Review (NCT baselines, Eaton calculations, kick/loss analysis).\n- **Section 5**: Mud Performance & Consumption (fluid properties, barite consumption, disposal records).\n- **Section 6**: Wellbore Integrity & Safety Events (casing tests, FIT results, MOC logs).\n- **Section 7**: Lessons Learned & Best Practices.",